<?xml version="1.0" encoding="UTF-8"?>
<xs:schema xmlns:xs="http://www.w3.org/2001/XMLSchema">
  <xs:element name="lista_ciudades">
    <xs:complexType>
      <xs:sequence>
        <xs:element name="ciudad" maxOccurs="unbounded">
          <xs:complexType>
            <xs:sequence>
              <xs:element name="id" type="xs:string"/>
              <xs:element name="nombre" type="xs:string"/>
              <xs:element name="tipo" type="xs:string"/>
              <xs:element name="region" type="xs:string"/>
              <xs:element name="imagen" type="xs:string"/>
              <xs:element name="descripcion" type="xs:string"/>
            </xs:sequence>
          </xs:complexType>
        </xs:element>
      </xs:sequence>
    </xs:complexType>
  </xs:element>
</xs:schema>